Comment Parent ID,Comment ID,Comment Text,Comment Score,Comment Depth,Created Timestamp,Author
t3_lwof70,gpjb6ek,"Current situation in Myanmar is neither war zone nor battleground. It’s clearly a massacre, killing unarmed civilians intentionally by state-sponsored terrorists. 
ミャンマーの現在の状況は、戦争地帯でも戦場でもありません。 明らかに、これは虐殺であり、国家が資金提供したテロリストによって非武装の民間人を故意に殺害する行為でした。
缅甸目前的局势既不是战区，也不是战场。 显然，这是一场屠杀，是由国家资助的恐怖分子故意杀害手无寸铁的平民的行为。",37,0,1614781576.0,Emmara9
t3_lwof70,gpjjbv2,"Wow, fuck that one sucks, same age as me. Get fucked Myanmar government",26,0,1614785351.0,CommunistCheshire
t3_lwof70,gpjc5rs,"This hit me hard. Holy shit. Godspeed guys, I hope all the best for you. Fuck the terrorists.",14,0,1614782057.0,Seisokki
t3_lwof70,gpjn5x7,"I love how the UN glorifies itself in “peacekeeping” yet time and time again they’ve proved worthless as an organization. As with my country and many nations across the globe that cry out for peace and the end to brutality. 

I guess sanctions would do the job to an already hard hit economic country??? What a joke of an international council we have.",9,0,1614787047.0,None
t3_lwof70,gpjav2c,[deleted],9,0,1614781423.0,None
t3_lwof70,gpjgas5,[removed],6,0,1614783990.0,None
t3_lwof70,gpldc3g,I don't care anymore. This isn't something we can just let happen. We have a moral obligation to help. That is what America is supposed to be. This would be an excellent chance to show that side of US again.,4,0,1614814371.0,None
t3_lwof70,gplsdtz,"Why are you not taking arms !!??  They are killing you one by one,  peaceful protests wont do shit !!! Arm yourself before its too late...this is sickening",3,0,1614822592.0,None
t3_lwof70,gpq6lbe,This is what they do to kids who try to save the world,3,0,1614909996.0,Imaginary_Gas_8604
t3_lwof70,gpxxhk8,Myanmar Military are the Murderers in ASEAN AND THE WORLD!! ON THIS DAY PLEASE RECROD THIS AS THE WORLD’S GUINNESS RECORD FOR CRUELEST MILITARY BACKED BY CHINA AND RUSSIA!!,3,0,1615035400.0,chia_churn_chou
t3_lwof70,h8qvxs9,Rest in peace Hero,3,0,1628829083.0,Psycho_path_25
t3_lwof70,gplfy1q,All countries and UN not only condemn the Myanmar military. Pls take action to save the poor and brave Myanmar people.,2,0,1614815702.0,Odd_Caregiver_9529
t3_lwof70,gpljfr7,"its very sad state for the people in myanmar.  no countries nor UN can ever really help.  coup cannot be overturned except by its own people.  NO any form of pressure external parties/countries, rhetoric, sanctions, etc will ever bring democracy back in myanmar.....just look at history...only the people can if they prevail...really uphill tasks and many lives at risk.  May God help them",2,0,1614817532.0,vtankuku
t3_lwof70,gpmhqpe,"I wonder what her shirt said. Rest in peace, poor girl. I'm sorry you had to die like this. Your people deserve better. You have my respect.",2,0,1614836666.0,None
t3_lwof70,gpjx4ox,"You should take the second pic down. Some weirdos enjoy that sh\*t. Give her some respect, she is a hero.",1,0,1614791315.0,TheRiseOfSocialism
t3_lwof70,gpmozjf,Source? News article? Report? Like you can just post this violent act and not give a source.,1,0,1614842399.0,Le-Budder-Bot
t3_lwof70,gpkt3qs,F,1,0,1614805089.0,Zb990
t3_lwof70,gplobmx,Why is this happening?,1,0,1614820491.0,hoodiepatto
t1_gpjb6ek,gpjkxt1,"Damn....

They could have shot her anywhere non-fatal (edit: ""that'snot 100% fatal), like arms or legs. Those brutal military are treating the citizen like some games. What does it takes for anyone to shot someone harmless in the head that's 100% resulting in the termination of an otherwise long long life?",15,1,1614786071.0,very-soon
t1_gpjb6ek,gpko21w,"Are they really state sponsored?

Maybe I'm just differentiating between military and government tho",1,1,1614802906.0,megaboto
t1_gpjjbv2,gpjt90n,May God bless her,10,1,1614789673.0,Emmara9
t1_gpjc5rs,gpjswru,May God bless her,2,1,1614789530.0,Emmara9
t1_gpjn5x7,gpjt7bv,Sanctions isn't enough for the dictator.He doesn't care about sanctions. He can sell natural resources to communist.,6,1,1614789654.0,Emmara9
t1_gpjn5x7,gpk2468,I thought the UN was about putting US troops in strategeic spots across the world under the guise of peacekeeping.,2,1,1614793440.0,GreenSky2077
t1_gpjav2c,gpjsv4f,May God bless her,1,1,1614789510.0,Emmara9
t1_gpjgas5,gpjsxvn,May God bless her,3,1,1614789543.0,Emmara9
t1_gpldc3g,gpli28i,China won't let US meddle in Myanmar. It could get ugly if US tried something.,3,1,1614816811.0,WrongCalculator
t1_gpldc3g,gpn4tdm,Remember they were the one that betrayed my country (South Vietnam) and allied with the enemy (China).  I have zero trust with the U.S government.  U.S government prevent U.S military from doing their job.,3,1,1614857277.0,Dead_Revive_07
t1_gpldc3g,gpm994n,We want help from US and UN. They are our hope.,2,1,1614831300.0,Emmara9
t1_gpldc3g,gpm9774,We want help from US and UN. They are our hope.,1,1,1614831269.0,Emmara9
t1_gpldc3g,gpm1dtd,"so the US can install another puppet government and and destabilise the region for resources? No, let the people decide their own destiny, not some Washington bureaucrat",1,1,1614827070.0,PolarBearAppreciator
t1_gplsdtz,gpm9i5d,Our leader said to protest peacefully so we stand as much as we can.,3,1,1614831441.0,Emmara9
t1_gplsdtz,gqpnt7t,That would just mean more deaths for BOTH sides.,2,1,1615571130.0,SkyMix_RMT
t1_gpmhqpe,gpn4pi1,"It said ""Everything will be okay""",7,1,1614857184.0,Dead_Revive_07
t1_gpmhqpe,gpmitzz,May God bless her,1,1,1614837462.0,Emmara9
t1_gpjx4ox,gpk3wkb,I disagree. There might be some people who take pleasure in it but you shouldn't censor these things. People need to know the horrible ugly truth. It makes much more of an impact.,8,1,1614794200.0,Fat_Beet
t1_gpjx4ox,gpkhcb2,No. People should see the horrifying reality.,7,1,1614799996.0,MrCalac123
t1_gpmozjf,gpmpff3,"I am neither journalist nor reporter. You can search by yourself by typing VOA, BBC, RFA",4,1,1614842778.0,Emmara9
t1_gplobmx,gpo4c17,The military Junta of Myanmar is pure evil,3,1,1614876327.0,None
t1_gplobmx,gpm9dat,This is because of military coup.,1,1,1614831365.0,Emmara9
t1_gpjkxt1,gpjrvzc,"yeah, I agree. But the shouldn't have shot her at all",18,2,1614789092.0,Cowgod_107
t1_gpjkxt1,gplvw0e,"Long story short, a fortune teller told the dictator Min Aung Hlaing that he will die by headshot. So he is killing protestors with headshots cos he think it will magically counter his death. Basically, he is a total piece of shit",11,2,1614824341.0,HelloPeopleImDed
t1_gpjkxt1,gpk4tu3,"There is no such thing as ""shooting somewhere non-fatal.""

When you shoot someone you shoot to kill, that's basic firearms training.",10,2,1614794596.0,None
t1_gpjkxt1,gpjstyr,May God bless her,4,2,1614789497.0,Emmara9
t1_gpjkxt1,gpk9vfx,Shooting someone in the arms or legs may actually be more deadly than say a body shot seeing how bullets bounce around in bodies and is much more likely to hit an artery. The point is no real bullets should hAve been used at all though,0,2,1614796761.0,VapeThisBro
t1_gpjkxt1,gpkod1h,"I don't know if it fits, but from a video i saw about police being asked ""why don't you shoot the leg or something"" is for 1 you might miss, you already miss most and missing can bring you in danger(though this is unrelated) and 2, anything can easily be fatal. There are arteries basically everywhere and you can hit one with ease, and if you hit a bone and that splinters, good luck

This one however clearly went for the kill",1,2,1614803041.0,megaboto
t1_gpjkxt1,gpmch8e,"I’d argue they shouldn’t have shot at all, but your legs are still just as lethal because of major arteries PLUS ricochet. Arms not so much, but once again, ricochet plus it’s a hard shot to even land.",1,2,1614833221.0,Anime__Jesus
t1_gpjkxt1,gpo4z6e,"Thats not how guns work...its not cod where you shoot someone in the leg and they take 10 damage. You have major arteries running up your legs and other parts of your body. Shots there are often fatal. Also, it's a lot harder to aim for the legs and arms. Shooting from 10 meters out isn't as easy as you'd think.",1,2,1614876602.0,Ibuybagel
t1_gpjkxt1,gq3vb9q,"Arms or legs is still as fatal as in the body, because we have the main arteries running there. This is a common fallacy, IE: Just shoot him in the legs",1,2,1615133228.0,Gasvajer
t1_gpko21w,gpmbw53,"Our ""government"" before this was a quasi-democracy. Although we were on paper ""democratic"", our constitution (written by the military that oppressed us and killed ethnic minorities for decades) always allowed 25% (regardless of votes) of the seats in parliament to the military. Thus, we had a civillian branch (75%) and military branch (25%).

Additionally, the military had it's own political party called USDP which people (extremists right wing supports like Wirathu, basically the Hitler for Rohingyas) could vote for. So this means that the Military (military branch and USDP) had a lot of control when it came to our decisions. They control immigrants and defenses and more, as they were the ones who massacred the Rohingyas. We're fighting now for democracy, meaning to eliminate the 25% (and more) share that the military dogs hold in our country. 

Our government now is the CRPH who are the rightful democratically elected leaders in hiding. They are basically working to represent Myanmar in the UN and so on. The military are the ones who assumed the position of government by force. Their dogs (police and soldiers alike) are the ones who killed the Rohingyas and and the ones who are killing us now.",1,2,1614832859.0,IyrMM
t1_gpk2468,gpk3kq5,"Today, we feel sorry and deep condolencent to our 57 heros who died by brutal attack of military. We don't want to say Save Myanmar anymore. We know our lives are cheap because we are poor. May God bless to all.",1,2,1614794061.0,Emmara9
t1_gpli28i,gpmvg1h,I know. I don't care. We cannot let a bully hinder us from doing the right thing. If we have the capability then it is our moral obligation to help. It cannot be more moral to just watch as people are killed for wanting freedom.,3,2,1614848344.0,None
t1_gpm994n,gpmvm31,I feel you man. I wish I could snap my fingers and have the marines storm your beaches to fight for you. All I can do is pray that my country realizes we have a moral obligation to help.,4,2,1614848506.0,None
t1_gpm994n,gpq6xz3,US and UN will do the same thing to you make no mistake in this false hope,2,2,1614910184.0,Imaginary_Gas_8604
t1_gpm1dtd,gpm8f7z,What exactly are the people of Myanmar going to do besides get gunned down?,2,2,1614830829.0,ziggyzane
t1_gpm1dtd,gpmuypb,"This is a reply I got from another comment I made:

I'm a Burmese currently living in Yangon.

1. Yes. I very much want the USA to get involved. It doesn't even have to be armed forces. Drone or missile strikes would be enough. And this is what nearly everyone in my country wants right now. A lot of people are so desperate for US help to the point they want to give away some land to the US or they would happily become a US colony.
2. I personally don't feel that way. But everyday, we feel helpless for all the dead people that we couldn't save. How can we, an unarmed population, win a fight against an armed and trained military? For most of us, foreign intervention is our biggest dream now.

Most people here see the US as world police, in a good way, and that's what I see too. If the US never took part in the Korean war, there wouldn't be South Korea of today. What I always tell to those who don't like the idea of the US being world police is this - imagine China or Russia being world police. The only reason the entire world (except america of course) hasn't been annexed by China and Russia is because they fear the US. Otherwise, the organ harvesting done by CCP would be done everywhere.

Back to my comment:

I think it is pretty clearly worded what they want, guy.",1,2,1614847872.0,None
t1_gpm9i5d,gpo4a1i,Peaceful protests have never worked without some kind of leverage. Or the alternative of violent riots. Governments like to praise Gandhi because in most cases doing what he did won't actually be effective.,4,2,1614876304.0,None
t1_gpm9i5d,gpn3lhe,"You need a backup plan, and that means arming yourself...",3,2,1614856204.0,None
t1_gpm9i5d,gpq6qpx,I pray for the downfall of your oppressors and the oppressors of this world!,2,2,1614910075.0,Imaginary_Gas_8604
t1_gpn4pi1,hyca5qf,Fuck,1,2,1645763434.0,zR0B3ry2VAiH
t1_gpn4pi1,ih4b7oe,😳,1,2,1658446035.0,d1l1cube
t1_gpk3wkb,gpkfx5d,Exactly. Never censor the truth.,7,2,1614799394.0,ByAnyMeansNecessary0
t1_gpmpff3,gpmpila,"Come on dude, why post this? This just seems like fear mongering.",0,2,1614842855.0,Le-Budder-Bot
t1_gplvw0e,gptezrs,Ru serious?!,6,3,1614978274.0,AnalHurtz420
t1_gpk4tu3,gpnsyl4,"I believe u can shot to disable.

Perhaps i phrase it wrongly... ""less fatal than a headshot""",4,3,1614871366.0,very-soon
t1_gpk4tu3,gpm2b09,Fucking thank you^,1,3,1614827545.0,LenTrexlersLettuce
t1_gpk9vfx,gpnsqrm,"Best is not to shoot at all.

I am compromising.... i dont think shooting ANYWHERE is more deadly than a HEADSHOT.",1,3,1614871270.0,very-soon
t1_gpkod1h,gpo53kr,That is true. Most people have zero understanding of how guns work.,1,3,1614876654.0,Ibuybagel
t1_gpo4z6e,gpo7ju3,"Yes. Thats highly possible.

But that vs a bullet in the head. If they wanna be in their superior good books at least give the innocents a fighting chance to survive.

I'm pretty sure i can headshot a fig.11 in prone at 50m, without scope in daylight. So at 10m is highly possible to aim ANYWHERE but the head.... those damn terrorist!",2,3,1614877709.0,very-soon
t1_gpo4z6e,gpo50cz,10 meters is 10.94 yards,1,3,1614876616.0,converter-bot
t1_gpmvg1h,gpn5mki,"Vietnam War, U.S never dared to invade North Vietnam for fear of China.  Had they done so the war would end in less than a year instead it got dragged out to 20 years.  U.S being a world police is a joke.",2,3,1614857963.0,Dead_Revive_07
t1_gpmvm31,gpmxxwn,"Yesterday, we lost around 39 protestor heroes who tried for democracy. Most of them died with gunshot head. They are just unarmed peaceful protesters. We hate a lot Myanmar military, the terrorists.As our leader request to protest peacefully to get help from UN and US so we do our best. But dying our heroes day by day is nonsense. Military never care about our lives since 1962. Pray for Myanmar.",3,3,1614850782.0,Emmara9
t1_gpq6xz3,gpqv7gf,Even false hope makes a little bit of energy.,1,3,1614924690.0,Emmara9
t1_gpm8f7z,gpmer1d,"It's in the hands of the Burmese people now, who are just as capable of overthrowing a dictatorial regime as anyone else. If things keep escalating then they stand a pretty good chance of toppling the military junta through a revolution.

Most Western powers have condemned the coup, but I can't see us being able to take any direct action. And frankly, I don't trust my own country to not end up supporting the coup by mistake. Or even worse, to not try to profit from the situation.",1,3,1614834669.0,Raccoon30
t1_gpmuypb,gpn57uc,"Yet they betrayed my country (South Vietnam) and allied with China when South Vietnam was keeping the NVA (North Vietnamese Army) at bay for 1.5 years after all U.S troops left, the fund that was promise by the U.S for ammunitions and weapons never got deliver because if it did South Vietnam is another South Korea. They backstabbed their own allies and American soldiers died in vain.",3,3,1614857619.0,Dead_Revive_07
t1_gpmuypb,gpmvwcl,"I'm sure that one comment of wanting to be a US colony is representative of the entire population of Myanmar and not just someone who happens to have a hard on for the US. After all, nobody ever lies on the internet, do they?",1,3,1614848783.0,PolarBearAppreciator
t1_gpo4a1i,gpodv3h,"Yeah, wee are waiting P2P from UN if not we need to find the way.",2,3,1614880416.0,Emmara9
t1_gpn3lhe,gpn4z2a,"Most leaders request to protest peacefully. If UN and US will not come to Myanmar, we need to change plan.",1,3,1614857412.0,Emmara9
t1_gptezrs,gqfrzrb,"yes. all because of superstition, this dictator is killing the people",6,4,1615378561.0,HelloPeopleImDed
t1_gpnsyl4,gpntofc,That's only something that's done in movies & TV. In real life if someone is pointing a gun at you they are already ok with killing you.,5,4,1614871681.0,None
t1_gpnsyl4,grn1ry2,"You believe wrong. No firearms training anywhere teaches one to ""disable"". Guns are for killing. Full stop.",1,4,1616279995.0,capnclutchpenetro
t1_gpo7ju3,gpo7udb,"I mean....do you really think someone opens fire on an innocent civilian reaaaallly cares about their well being? You don't shoot to wound, you shoot to kill. If they cared about those people, they wouldn't be firing on them in the first place",1,4,1614877834.0,Ibuybagel
t1_gpo50cz,gpo7lo1,"Do i say ""good bot"" here?",1,4,1614877731.0,very-soon
t1_gpn5mki,gqtbw8d,"Yeah. The US would not get involved unless they see it would be beneficial to them. Then entered VN war because they wanted to stop communism, not for the benefits of Vietnamse",2,4,1615655409.0,duonghoang2709
t1_gpmxxwn,gpn4znw,I'm curious but what is Myanmar like from 1962 to 2011?  I wonder how it compare to Vietnam from 1975 to the present?  How do the Junta compare to the VCP?  Because Vietnamese people can be kill by our government if we speak up.,2,4,1614857427.0,Dead_Revive_07
t1_gpmer1d,gpmv9zv,"How is it moral for us to just stand by and watch, if we have the means to liberate the people of myanmar?
Some folks are not capable of helping themselves. That is okay. That's why some people take it upon themselves to protect those people.
I believe it is our moral responsibility to intervene, no matter the optics. The burmese people cannot help themselves, especially since China is seemly wanting to meddle themselves and help the tyrannic military regime.",2,4,1614848180.0,None
t1_gpmer1d,gpmf002,Overthrow them how? Word's are not more powerful than bullets?,1,4,1614834829.0,ziggyzane
t1_gpmvwcl,gpmw3um,"Yeah no I think the US colony part was a bit much. However, the general idea still remains. We have the best and most well-trained armed forces in the world. But we can't help the people of myanmar from tyranny? I think it is our moral obligation to liberate them. Get back to what America is supposed to be, you know? I want to be proud of my country. Still am, but would be even more so if we helped them.",1,4,1614848993.0,None
t1_gpodv3h,gpq6teq,UN is complicit in your oppression,2,4,1614910115.0,Imaginary_Gas_8604
t1_gpn4z2a,gqtytt5,"That's a joke tbh, military dictatorships don't understand peace, they'll keep shooting civilians.

Try learning about the similar conflicts, like the one in my country, Syria.

No one will care about the suffering that'll befall you, your military isn't just a normal one, it already participated in genociding the people of arakan, to them human blood is nothing.",3,4,1615667440.0,TheLostArab
t1_gpn4z2a,gqtbi57,"If u think the US gonna come and save Burmese, then you are delusional.",1,4,1615655208.0,duonghoang2709
t1_gpntofc,gpnv0ez,"I disagreed. They are many who can aim a weapon at someone but ain't ready to kill.

Back to this topic..

They are ordered to carry arms.
They are ordered to take aim.
They are ordered to fire.

In their shoes, if u really aint retard and have half a heart, where will u shoot?

And what's your point on these soldiers choice of action?",4,5,1614872273.0,very-soon
t1_grn1ry2,grok1u2,"I am not talking about training. Its the morality & humanity in question here.

So u believe the junta soldier is right to do headshots on unarmed civilians?

#training in firearms to kill doesn't erase the sin to shoot an unarmed teenager running away from you in the back of her head. Full stop.

I said ""can"" mean morally u can choose to shot and not aim for the head, giving some possibility of not killing. Aiming for the head gives zero change to survive and that is intent. Hypothetically i am ordered to shoot u. U want it on your head or anywhere else?

Ok. U are trained to shoot. So?

U are trained to kill. So?

U are ordered to fire but what type of person will (allegedly listen to orders) and shoot the head of an unarmed kid? And she was running away! Shot in the back? U trained to do that?

Have u been trained in firearms to kill before? Or are u trying to tell ppl here u have been? I really dont see your intent for that post.

Oh... why are u talking about firearm training so many weeks after she laid to rest? Where are u from? Where your moral lies?",1,5,1616314227.0,very-soon
t1_gpo7udb,gpo8a7g,"I am just hoping some of them got no choice but to fire. And not all are hard brainwashed killing tools.

Then again, u r right. let's be safe and assume all of them aim and are prepared to shoot to kill.

Had a nice discussion bout this in here somewhere.",1,5,1614878025.0,very-soon
t1_gqtbw8d,grnjs0y,Haven’t China and Russia blocked the United Nations from condemning the coup though. Fuck communism,2,5,1616289096.0,None
t1_gpn4znw,gpn57as,"For example, the situation in Myanmar was 1962 and 2010 like North Korea, 2011 to 2015 like Vietnam, 2016 to 2020 like Thailand.",2,5,1614857607.0,Emmara9
t1_gpmv9zv,gpnmpz4,"Do you want a second Iraq war? Where anywhere from 100,000 to 200,000 civilians died?

A military intervention, like your suggesting through the use of the word ""liberation"", would kill far more than it would save. And would just result in Myanmar being ""under new management"", with a government subject to the whims of the western military garrison. Hardly better than the junta.

&#x200B;

> The burmese people cannot help themselves

What a lovely way to infantilise a whole nation. Revolutions have been performed in worse circumstances. 

We can, and should, draw attention to the cause. We can also provide financial aid to any protesting organisations. However, to think that any direct intervention wouldn't result in the same military catastrophe as the Iraq and Afghanistan wars is short-sighted at best.",1,5,1614868509.0,Raccoon30
t1_gpmf002,gpnkyd4,"Yup, but the junta might just lose their monopoly on violence",1,5,1614867630.0,Raccoon30
t1_gpmw3um,gpmz0sc,"America cannot, and should never, be trusted as the world police. 

They have routinely shown to exploit that position for their own profits. 

They have installed puppet dictators to get cheap oil. They have assassinated innocent left-wing activists because they threaten American profits. They’ve couped entire democratically-elected governments just to squash any talk of nationalising precious resources. 

Why do you think America would stop this, when this happens in America without repercussion? If they- you- cannot even reign in your own police force, what gives you the audacity to think you’d reign in your troops? Because you didn’t in the middle east, you didn’t in latin america... instead, your country made a whole law that if **anyone** held American soldiers to account for war crimes, they would **invade that country**. 

The moral obligation you speak of isn’t to ramp up your evidently morally corrupt military. There’s an argument for helping monetarily, but even then, America can’t be trusted to not include predatory payback terms in that help- “we’ll help you out, if you let us do x y and z”. 

The moral obligation is to realise you’re not better than these people and that you need to fix your own broken system that defines “any male over 16” as a terrorist so long as they’re in a country that the US is bombing or invading. The moral obligation is to stop American companies profiting off of war & tragedy. The moral obligation is to ensure that if you were to help, you wouldn’t just be replacing one evil coup with another. Until then, America will just make the situation worse.",5,5,1614851846.0,aRatherLargeCactus
t1_gpmw3um,gpn5b1x,They didn't even help Cambodian people against the Khmer Rouge.  They let them die.,4,5,1614857694.0,Dead_Revive_07
t1_gpmw3um,gpmwahu,"right, and ""liberating oppressed people"" has worked so well in the past when the US got involved, right? My eyes tear up thinking about all those poor oppressed populations who were granted free, sovereign democratic republics by the benevolent American Empire, like:",1,5,1614849177.0,PolarBearAppreciator
t1_gqtytt5,gqv22ji,"Thank you for your advise. We are now changing our plan. Luckily, we have other races who possess army. We will try our best.",1,5,1615690001.0,Emmara9
t1_gqtbi57,gqtk3p2,I don't think US will come to Myanmar.We just wait R2P and if R2P don't come we have another plan but I think the war will appear between China and other countries.,1,5,1615659693.0,Emmara9
t1_gpnv0ez,gpnwbpi,You obviously have never touched a firearm in your leaf. Please go watch firearm training videos on youtube so you can understand this concept better. You are spreading misinformation right now.,4,6,1614872849.0,None
