Comment Parent ID,Comment ID,Comment Text,Comment Score,Comment Depth,Created Timestamp,Author
t1_gpn57as,gpown1y,"Wait you are saying since 1962, your country and your people suffer like North Koreans?  What I mean is you faced starvation, children born with skin and bone (from starvation), people being put in prison, executed, and etc...?  Vietnam from 1975 to the death of Le Duan (most evil man in Vietnam history) was similar if not worst than North Korea, which is why the boat people happen and 250,000 people perished at sea but it was better than to stay behind.  You had a handful of rice and one tiny meat as food every three weeks.

I want to make sure that what you are saying as I want to understand what really happen under this military dictatorship so I can better the situation and how dire it is.  Because Myanmar was shut out from the world for so long, most of Southeast Asia didn't particularly pay attention to Myanmar and can only guess what went on during those time.

So I want to ask you this question.  If the military dictatorship win, will they treat the country similar to how Vietnam is right now or will it go back to 1962 all over again?  I don't know any Burmese people in the U.S so the only info I get is from the news and social media which isn't a lot to go on.",1,6,1614888214.0,Dead_Revive_07
t1_gpnmpz4,hnrvao6,"Yes, a few rifles vs chinese drones and missiles, they really do stand a  great chance in this revolution. bullshit",1,6,1639000845.0,dstrezzd
t1_gpmwahu,gpmwtpu,"Off the top of my head I can think of:
South Korea
Kuwait
France
Belgium
(Germany by not letting the USSR take the west)

Now like you said, it hasn't always worked out great when the US gets involved. The countries mentioned above are the best examples  I could think of, but there are many more that I can't put on that list. Vietnam, Irak, Afghanistan, etc have all been failures. 

 That is exactly why I think we need to go to Myanmar. The US has had a bad record of trying to be the world police. But if it's not gonna be US, then nobody will try. We are in a unique position to reshape the American identity back to what it was post WWII. And by God do we need that.",1,6,1614849699.0,None
t1_gpnwbpi,gpnxjsf,"I was a soldier many years ago. I do however admit i had never shoot at any humans. I still have some spare bolt cam pins around cos they are easy to lose in the dark. I also have a slight burnt scar on my left cheek cos i m left handed and the dust cover happened to be designed on the right. Thou i don't do small arms.

So i am telling you i can follow orders up to the point of shooting civilians in the head. I would however ""miss the head""

I can see u are unhappy with my opinion and unable to accept disagreement with your opinion.

#We were talking about the evil acts of the soldiers in the coup. Their mental state and other options if they have a heart. Not firearms training.

However, its apparent that you take this personally and your 2nd statement started attacking me ""obviously"" and your 3rd statement is an accusation; please elaborate misinformation? Just curious which weapon are u trained in? Youtube excluded.

But if you can't keep your cool and going to take it immaturely, then don't reply and accept my apology that my opinion has offended you.",4,7,1614873382.0,very-soon
t1_gpown1y,gpqtjhm,"If the dictator win again Myanmar will go back to 1962.
At 1988, over 1000 people died in list but many dead bodies missed and many people being put in prison. Many youth were kipnapped. Many young ladies were raped infront of their parents. Many children were killed in front of their mother and their mother were raped in front of their husband. Many houses were burnt. That's Myanmar Civilians run to neighborhood countries and become refugees. Most of these situations suffered the civilians in rural areas.",2,7,1614923455.0,Emmara9
t1_hnrvao6,hnrxbmt,"It's been nine months you absolute necromancer.

You're still advocating for military intervention on the scale of the Iraq war. A position which is just as stupid as it was nine months ago.",1,7,1639001651.0,Raccoon30
t1_gpmwtpu,gpmxel8,"South Korea was turned into a fascist US puppet state which only managed to gain some vestige of representation through hard fought victories, Kuwait was a political move for control over oil prices, and what the fuck are you on about with France and Belgium lmao, you're really gonna use world war 2 as the prime example of American pride? Also, the fact that you needed to put ""etc."" on the failures should be very telling to yourself about your biases lmao

The US has taken every opportunity it has ever been given of being world police, from Lybia to Haiti, Cuba to Iran, Iraq to Vietnam, Laos to Afghanistan, Indonesia to Nicaragua, Guatemala to Bolivia, the list could quite literally go on for several more minutes. At best, the people are rewarded with a destabilised US puppet state with a thin veil of corrupt parliamentary representation ultimately decided by American interests covering military bases and resource extraction, and at worst they are left with fascist oligarchies and open air slave markets in what used to be some of the most developed countries of the region. The last time the US did anything even remotely good in terms of foreign interference was tackling the Nazis, and even that was done out of desperation when they realised their policy of isolationism was gonna let the USSR gain more influence. The US has always been an imperialist oligarchy just looking for new land to conquer and influence, and this would be no different.",2,7,1614850257.0,PolarBearAppreciator
t1_gpnxjsf,gpnzgl0,"I was never talking about the soldiers. I only joined this thread to point out nowhere on Earth is any armed force trained to ""shoot to maim,"" it's simply not done anywhere. Even in America they don't teach you to shoot people in the legs in training courses anywhere in any state. 

People trained with firearms will be shooting for center mass if they are shooting *at* you. I believe implying there is a ""less lethal"" way for soldiers/police to shoot people gives people that don't know about guns a false sense of security in situations like this. If you tell people ""relax, they will probably just shoot to injure is"" they will take dangerous risks that could get them killed. You could risk someone elses life by giving them false info.",2,8,1614874219.0,None
t1_gpqtjhm,gpr6lua,"Yeah if it goes back to 1962, I think its over for the people of Myanmar.  It will be a long time before Myanmar can even catch up to the rest of Southeast Asia as if I'm not mistaken Myanmar is the poorest country in Southeast Asia?  Even poorer than Cambodia and Laos?

I had this talk with my dad after asking you this question.  My dad say the Myanmar military is not as bad as the VCP because the VCP follow a communist doctrine while the Junta have no such doctrine.  He also said that the soldiers are loyal to the VCP while the Myanmar soldiers are not brainwash as only the top leader of the military are corrupt and cruel.  He said there are bad soldiers but not all soldiers are bad.  We both agree that if Myanmar fall again, people of Myanmar will be worst than the Vietnamese.  He explain that it will feel much worst due to anger as Myanmar got to experience a quasi-democrat government.

He say the main differences between the Junta and VCP is Myanmar was colonized by the British which gave them autonomy and independent when they left while Vietnam was colonized by the French which destablized Vietnam after they left.  This is why communism will never happen in Myanmar despite the fact that it does seem to have CCP backing.

One thing I would like to ask you is why do you think that Myanmar will go back to 1962 instead of Vietnam currently?  The reason I ask is that while Vietnam GDP grow every year, the VCP literally steal 95% of the country wealth.  In 2014 alone, the U.S had to froze bank account because the VCP stole 146 billions from the Vietnamese people.  146 billions X 46 years (different GDP but you get the point) and that why Vietnam is still a poor country.  Same with Myanmar, Cambodia, Laos, and etc...

Let me know if you think anything my dad said is wrong?",2,8,1614934424.0,Dead_Revive_07
t1_hnrxbmt,hnrza7e,"I didn't advocate for that, I said what I said and you deflected.",1,8,1639002434.0,dstrezzd
t1_gpnzgl0,gpo0tgz,"Ah... good. U are calm now. Let's discuss further. 

Yes. Soldiers are trained to kill. Having mercy to enemies is being unmerciful to ourselves as well as the men next to you. In fact, headshot is golden. And we are taught to squeeze twice in CQB and FIBUA.

But these assholes are not dealing with armed enemies who are going to kill them (thou i believe at this point many alreay mentally killing these assholes). They are killing unarmed, non life threatening civilians! 

I dont mean to tell people to relax, the army is just aiming to injure. All the protestants knows these army are capable to be heartlessly aiming to kill in the head in one shot like game.

But i am coming from a perspective of a myanmar soldier with an ounce of conscience... that perhaps even under orders, could target anywhere but the head. Maybe some of them exist, hence some stray rounds..... BUT let me be crystal clear here just in case....

#to our heroes here... know that the military is capably to kill. Please be smart, stay safe. Run if you must, take cover. And live to see a truly democratic myanmar in the near future.

They know the risk. They know someone may be killed. Yet they stand up as one without violence. They are heroes.

We may have started off on the wrong foot but I'm glad we can engage in a more meaningful discussion now.

Cheers.",2,9,1614874812.0,very-soon
t1_gpr6lua,gprfo7i,"1) Most of the soldiers including their family are brain washed
2) Not only customs but also generals are already brain wash because they get lots of benefits from their work
3)The history of 1962 start because of Nay Win. He made plans and protocol about military coup and how to manage the army.How to control the Civilians and the news. This military coup depend on his protocol.
4)I don't want to compare with Vietnam because I don't know exactly about Vietnam and I visited there only one time but Myanmar Civilians are killed by military.This is happening in Myanmar even in arban cities, capital cities of Myanmar.
5)Now, we can't sleep well, eat well and don't know when we will die. In this condition, how can I compare with other country.If you want to know, just come to Myanmar.",2,9,1614942762.0,Emmara9
t1_hnrza7e,hns73fn,"Nope. You're still advocating for direct action against Myanmar. That means military intervention.

If you've changed your mind, what would you advocate for that I didn't already say I was in support of?",1,9,1639005706.0,Raccoon30
t1_gpo0tgz,gpo3hy1,"Any Myanmar soldier with ""an ounce of conscience"" would disarm or attach their head of command. Not continue to follow orders to oppress their own countrymen for money.",3,1,1614875969.0,None
t1_gprfo7i,gpspzgz,"Do Myanmar citizen (not Rohingya) get kill for no reason or only when they oppose the military like now?  Like do the Junta kill civilians for no reason from 1962 to 2011?

I forgot to mention one thing I talked with my dad was that, the Junta only had 25% of the seat in parlament in 2011.  We both strongly agree that this would never happen with the VCP or the CCP or any communist regime, they would laugh so hard at you and then execute you in some far away prison in some rural place.  This show to me and my dad (could be wrong) that the Junta are not as dangerous as the VCP.

I'm not downplaying the Junta, they are evil, I just want to understand how evil they are.  The communist soldiers already murdered millions of my people prior, during, and after the Vietnam War.  And we have over 10,000 political prisoners in Vietnam today.  People who want freedom for Vietnam so badly, some of them include Vietnamese Americans as well.  There is no freedom regardless of where you live if it isn't in your home country.

Do you know of any book that is written by Burmese about the Junta or what they did to the country from 1962 to 2011?",1,1,1614967001.0,Dead_Revive_07
t1_gpo3hy1,gpo4xjs,"Lol.... we all wished for that!

But that's not an ounce of conscience. It's BALLS OF STEEL!

Speaking of there are people who defects. We hope there are fine and safe. They military/police leaders are vengeful people.

You seen the photos where a bunch of police pissd on the flowers people laid on the site of a young boy killed? Makes my blood boils. Real incorrigible assholes.

Back to your statement.... that's one of the best outcome. really really wished for that to happen.",2,2,1614876581.0,very-soon
t1_gpspzgz,gq5matx,"Wayyy late, but I'll tell what I know  during my time around 2003-2010s and experience from my parents. Sorry if these are what you already known.  


The ethnic groups had it wayy worse than people in mainland. I have not heard getting killed for no reasons in mainland we were safe as long as we keep our heads down.  


I think the majority of their evil comes from economy!? After Ne Win took power, everyone had their possessions robbed by military(Cars, Businesses, etc) by various ranks from military(Majors, Captains etcs) leaving civilians dirt poor. Plus he denounced some of the currency that were in use because of some superstition, that hit the economy really hard too.  


Top brass controls almost every big corps here, some of them are billionaires(USD).One of the things I have experienced is the mobile phone scam. Myanmar Post and Telecommunication sold their first SIM cards around 5000usd per card around early 2000s and stayed over 1000usd for a long time. They even sold their last sim cards months before foreign telco companies come in with price of around 200$ as a last attempt. SIM cards are worth 1$ here now.  


If you do try to oppose the military its almost  guaranteed you are going to get jailed or tortured or killed. Everyone lived in fear, they do not dare to even have pictures of Aung San Suu Kyi or NLD Flag in their homes and hides them if they do.  


Unfortunately, I know about Vietnam only from a documentary. From what I could tell, the situation is really different as in there were a lot of people supporting north side. We do not have sides here, its always been people vs Military.  


Lastly, yes there are lots of books but I think it is going to be hard to find translated ones.",1,2,1615161528.0,oikoumene050
