Comment Parent ID,Comment ID,Comment Text,Comment Score,Comment Depth,Created Timestamp,Author,sentiment
t3_lz10do,gpyb4h3,"Gather the legions, it’s time to take back your freedom. Watching from USA. Please stay safe.",55,0,1615039818.0,Personal-Low4835,neutral
t3_lz10do,gpyrz3r,[deleted],36,0,1615044385.0,None,neutral
t3_lz10do,gpyckzk,How strong are those shields?,34,0,1615040170.0,None,neutral
t3_lz10do,gpy01rv,Nice. We just need to start kicking the military fuckwits Sparta style.,80,0,1615036397.0,nomoredictator,positive
t3_lz10do,gpzg4tg,"Honest advice...tighten the shield wall, especially in the middle.  What made the Roman shield walls so effective was how tight they were.  Plus, overlap will help some areas be better protected against small arms fire.  Also, if you want I would suggest practicing moving as one whole unit.  That will give you protection whilst being mobile.  A chant or some form of rhythmic grunting/noise can help keep everyone in sync.  Moving a shield wall like that as one whole group will require that as a metronome of sorts. 

I'd love to hear from anyone with better experience on how you can outfit their shields against bullets and not weigh them down.",24,0,1615050443.0,None,neutral
t3_lz10do,gpyilqp,SHIELD WALL!!!,14,0,1615041560.0,melzerz,positive
t3_lz10do,gpz67np,"Glad to know this one ,but all of you guys need to stay alert and be safe from the terrorists in Burma. The Military is becoming the worst. They are busy shooting at protestors and national TV channels are broadcasting fake news. China and Russia are aiding the terrorists in Burma to become our nation like their ones. Just need to restore Democracy in Burma. No more Terrorism and Dictatorship around the world. Dictatorship must fade away from each nation in the world. Truth finally wins eventually. Hoping we win in the end. Salute to all martyrs who have cost their lives in Democracy Revolution and guys in front of us to prevent from the attacks.",13,0,1615047883.0,Dull-Anteater-26,negative
t3_lz10do,gpyyik2,"Stay safe, stay anonymous, stay together, and record EVERYTHING. Wear goggles and anything helmeted to protect from hitting your head on the ground. 

You guys know about the road pylon trick for tear gas? Smother with water as well.

Use ONLY water, removing clothing and eye contacts, wash with water, cough, remove mucus from lungs and nose. 
Tear gas is a powder, pepper spray is different. Still wash with water",10,0,1615045962.0,septubyte,neutral
t3_lz10do,gpzlyjk,Testudo!! My fellow brothers 💪,7,0,1615052622.0,konay18b,positive
t3_lz10do,gpzexks,"That’s great with arrows, not any good when they start shooting through them unfortunately.",6,0,1615050092.0,None,negative
t3_lz10do,gpzqaiz,[deleted],7,0,1615054727.0,None,neutral
t3_lz10do,gpzwx0c,Also please use smoke bombs as well to help with at minimum slowing the police/military,3,0,1615056986.0,SnooAvocados899,neutral
t3_lz10do,gq0ce4w,someone post this to r/nextfuckinglevel,3,0,1615061909.0,Sabatar446,negative
t3_lz10do,gq0qybl,[deleted],3,0,1615066064.0,None,neutral
t3_lz10do,gq1hjbi,A whole lot of training before the real thing begins,4,0,1615074076.0,Oliver-Wendell2865,neutral
t3_lz10do,gq02y7a,"To all the people saying it won't matter when the bullets start, let me remind you that this is still a hell of a lot better than their bare clothes and flesh. If those shields even slightly slow down a bullet, it could mean the difference between life and death.",7,0,1615058967.0,None,neutral
t3_lz10do,gpyvs3y,"Jesus, the fact that they need to is horrible. I was in Myanmar in 2016, just around the time of the first real democratic elections in the country in a long time (maybe ever? I can't remember), and everyone was so happy about it. It's so sad seeing the military taking over the country all over again. Good luck, and keep fighting! I sincerely hope you guys can make a difference<3",5,0,1615045326.0,tomycatomy,negative
t3_lz10do,gpzin9n,We need to fight back. Beat them up giving some hard lessons when you isolate some fucking polices before let them go.,3,0,1615051231.0,choppystillwater,negative
t3_lz10do,gq2a3vj,God bless! Take the power back! Power to the people!,3,0,1615088697.0,MegaVibrator,positive
t3_lz10do,gq3ad94,"My father used to supply the Karen people with weapons and ammunition machines that let them reuse their ammunition. The military won't stop, they will keep killing until they achieved their goals and if necessary abolish democracy forever. You need to arm yourself, build groups, do guerilla like warfare. Destroy their equipment, go in the night and ambush their artillery and leave again, do this all the time, this will make the military withdraw as their equipment is vital for their success. Go military yourself in small groups, while keeping up the peaceful protests, but destroy their morality at night. Wound soldiers from afar with slingshots so their morale gets destroyed and so on.
Anyways I hope your protests will actually do something.
Try to fuck up nampong airforce base.

I don't know, it's time to pull out the beast in you, to form actual para military groups and do something vicious and morality destroying",3,0,1615119442.0,nug4t,negative
t3_lz10do,gpypnq9,[deleted],5,0,1615043753.0,None,neutral
t3_lz10do,gq1tvy9,Try making these bulletproof.  There are several ways this can be done.  There are everyday materials that can work as bulletproof.  This includes pure wool felt and silk.,2,0,1615078879.0,Accomplished_Stfox,positive
t3_lz10do,gq2ifgt,Really very stupid. The protestors shouldn't be letting the military get that close. The tin shields will provide ZERO protection from a bullet  of any calibre. People will die doing this.,2,0,1615094018.0,fotojourn,negative
t3_lz10do,gq329ts,Yall better have spears as well.,2,0,1615111155.0,humblenoob76,neutral
t3_lz10do,gsxdoou,"Not a strategist or anything, so take whatever said with a grain of salt.

Wouldn't those shield be worse? When a bullet hits one, the metal ripped apart and sends metal scraps towards the shield holder. If the military or police uses a shotgun, that's even worse because now you have metal shards along with it. 

It'll work on polices without guns, but I'm not sure if it's better if they have guns. 

What they need to do is not to fight head on. It's hard to win head on if you don't have guns and your enemies have way superior weapons. Brute forcing would result in a lot of death.

The alternative way would be to use guerrilla tactics, It doesn't matter if the tactics is petty either. You fighting a military dictatorship, use everything in your power to achieve your goal.

They need to use some kind of pepper-spray projectiles, even if it's primitive. Pepper powder should be accessible. (I don't know if this would work but maybe pepper powder covered in cloth? so when thrown it sort of explodes?)

For range, perhaps a slingshot or a sling could help. Mix that with some kind of pepper projectiles and hurl them towards the enemy.

Bows would work, but are difficult to make. Especially the arrow part as I assume that only arrows with a metal head could pierce modern armor vest.

Avoiding direct combat is probably the best choice as well, or there will be too much casualties. 

The other way would be to use cruel tactics. Somehow poison the polices or military water and food supply, use loud speakers (if you get one) and play loud gun firing sounds at nights to keep them mentally drained, and etc.",2,0,1617206247.0,Massepic,negative
t3_lz10do,gx5vz68,u/SaveVideo,2,0,1620316593.0,AndrzejDuda2020,neutral
t3_lz10do,hq9xb13,"The should be called ""The Freedom Legion""",2,0,1640698554.0,Mysterious_Unit3970,neutral
t3_lz10do,gpzpeb8,"This is why gun control is solely used to oppress the people.    
The fact that they have to take on corruption with tin shields speaks volumes.",3,0,1615054343.0,The_walking_man_,negative
t3_lz10do,gq1mcep,"The fuck is this? The Military will murder you. I’ve seen videos of people getting shot at for recording Soldiers walking outside in a private residence. 

Guns vs Shields = Guns Win 

Please don’t do this. This is suicidal. Use Guerrilla tactics instead. Hit and Run.",3,0,1615075586.0,Xianb1,negative
t3_lz10do,gpzr1k2,"Let this be a reminder of why and armed populous is vital for any country's freedom. Godspeed, protesters. 🙏🏴",1,0,1615055032.0,mchastain98,positive
t3_lz10do,gpz3lk0,AD FORMAM TESTUDO,0,0,1615047240.0,ThotlessIntelligence,neutral
t3_lz10do,gq2jpo4,This is what happens when you disarm the working class they resort to Roman tatics. Very sad to see that the pigs and the military are the only ones who get guns while the average worker gets shit.,0,0,1615094846.0,None,negative
t3_lz10do,gpyccf5,u/savevideo,1,0,1615040117.0,DamnYOU92,neutral
t3_lz10do,gq0z9yf,[removed],1,0,1615068693.0,None,neutral
t3_lz10do,gq10230,❤be strong Myanmar✊you're an inspiration to us in the USA! Be water🌊♥️,1,0,1615068916.0,2randy,positive
t3_lz10do,gq1q629,How thick is the shield?,1,0,1615076795.0,throwaway1817183,neutral
t3_lz10do,gq1xkdj,A good start for front defence .... but what about those snipers? I saw an image of a motorcycle helmet with a very suspicious bullet hole that was very near the top.... it looked like the bullet came down from a higher position.... 5.56 and above will definitely go through those shields.,1,0,1615081081.0,jwfc101,neutral
t3_lz10do,gq2buos,We have finally found the true descendants of the Rome,1,0,1615089778.0,Graywhale12,neutral
t3_lz10do,gq4scvg,What is written on the shields?,1,0,1615147905.0,akera099,neutral
t3_lz10do,gq59ayg,$NOK 🚀,1,0,1615155018.0,RyansVibez,positive
t3_lz10do,j7lfee7,Badass,1,0,1675790943.0,SpookeeMatty,neutral
t1_gpyb4h3,gq3al13,"Stay safe when you actually want to revolt against the military? I would suggest the opposite, go all in Form paramilitary groups for night actions, destroy their morale, actually fight them. But meh, this protest will just end with the military having achieved all their goals. Then it's all piece again",1,1,1615119636.0,nug4t,negative
t1_gpyb4h3,gpyxxze,Easy to say when its not you facing an apc,-20,1,1615045829.0,septubyte,neutral
t1_gpyrz3r,gpythxd,"Both tactics are required. We must overcome every advantage that they think they have.

The one thing they don’t want is for us to use their tactics on them with our numbers.",17,1,1615044774.0,undertheice71,neutral
t1_gpyrz3r,gq2oe79,"While you are not wrong, the fact they are this organized and cohesive is a good look.",1,1,1615098232.0,Gros_Tetons,positive
t1_gpyckzk,gpygdlj,"I am more worry of how much the shields can withstand bullets. Coz those fuckwit military dogs are shooting with live rounds. Stay safe, everyone!",61,1,1615041040.0,nandasithu,negative
t1_gpyckzk,gpyiki7,"Strong enough for rubber bullets but hopefully, slow down the small caliber rounds to avoid deathly wounds.",31,1,1615041552.0,AsuraNiche93,neutral
t1_gpyckzk,gpyikl0,good for rubber bullets. maybe good for 9mm fmj at about 100 yards or something. glhf with anything 5.56 and above.,13,1,1615041553.0,chileConChile,neutral
t1_gpy01rv,gpy0cpn,Indeed,21,1,1615036551.0,flabbajacks,positive
t1_gpy01rv,gpylhbw,Nice username,12,1,1615042252.0,victor_voorhees,positive
t1_gpzg4tg,gpzgeop,Thank you for the advice. We're still at the beginner stages of this tactic.,16,1,1615050528.0,flabbajacks,positive
t1_gpzg4tg,gq07xru,"There's no way any of these guys can carry shields that are actually bullet resistant.
https://ballistics.com.au/capabilities/personal-protection/police-military-shields/

A 90 cm tall shield that is resistant against pistol ammo (lv IIIA) weights 9 kg. Rifle rounds will go right through it. A 1.5m tall shield will weight 15kg.

The 1.3m tall shield that are resistant against rifle rounds (lv III) weights 19.5kg. 

If you lug around such shields, sure, the army can't hit you from a distance from the front, but you also can't run away fast enough. Close enough and they can easily flank you and shoot from the side. Or they could always bring up an APC, use 7.62 mm AP rounds or 40mm grenades.

That's why militaries don't use shields. They need to be able to run.",10,1,1615060594.0,None,negative
t1_gpyilqp,gpz5biq,[YES!!](https://youtu.be/6Iya9RID6mQ?t=54) I've been thinking that since I first saw shields being used regularly. It can be very effective when the right technique is used - definitely against rubber bullets and gas grenades.,5,1,1615047672.0,Joseph_Zachau,positive
t1_gpzlyjk,gpzmcsc,Rome is an IDEA💪🏻,6,1,1615052826.0,flabbajacks,positive
t1_gq0qybl,gq0rqqf,[deleted],3,1,1615066304.0,None,neutral
t1_gpypnq9,gpz181h,"Tbh a testudo would be a terrible idea, a grenade thrown in the middle of it by hand or a grenade launcher would scatter an untrained formation and made them flee over other protestants. A barricade would be more effective.",2,1,1615046633.0,BasileusBasil,negative
t1_gpypnq9,gpzcsnf,"The testudo formation was not even that commonly used by the Romans. It's effective against missiles as long as the formation stays together. Downsides are that it's very immobile and if a couple people in the formation go down it's difficult to reinforce the openings. Cataphracts were commonly used to create these openings, at which point it was no longer effective even for its intended purpose. The formation also had very little offensive capabilities to counter a charge or hold out in a melee.

Real bullets or even just stun grenades would likely break it very quickly and because of its relatively complicated nature it would be difficult to reorganise it under duress.

The absolute most effective use of the formation is to make stuff look cool in movies and video games.",2,1,1615049445.0,eldlammet,neutral
t1_gx5vz68,gx5w0ih,"###[View link](https://redditsave.com/info?url=/r/myanmar/comments/lz10do/myanmar_anticoup_protestors_practising_shield/)


 --- 
 [**Info**](https://np.reddit.com/user/SaveVideo/comments/jv323v/info/)&#32;|&#32; [**Feedback**](https://np.reddit.com/message/compose/?to=Kryptonh&subject=Feedback for savevideo)&#32;|&#32;[**Donate**](https://ko-fi.com/getvideo) &#32;|&#32; [**DMCA**](https://np.reddit.com/message/compose/?to=Kryptonh&subject=Content removal request for savevideo&message=https://np.reddit.com//r/myanmar/comments/lz10do/myanmar_anticoup_protestors_practising_shield/)",1,1,1620316609.0,SaveVideo,neutral
t1_gpzpeb8,gpztdnx,The fact you think your ar15 will help against the United States Army shows a big lack of combat experience lol. What's gonna actually get results is smarts in a situation like this. Not America first charging your gun.,3,1,1615055858.0,MindNinja757,negative
t1_gq1mcep,gq1u4h0,I saw another video of police just spraying water and tear gas. This will work against that. The shooting has started but it’s not the norm (or there would be hundreds or thousands dead by now). The military can’t be too brutal or it’ll invite a foreign army which they’re not equipped to fight against.,4,1,1615079016.0,-BlueDream-,negative
t1_gq1mcep,gq2jqve,Not yet.,2,1,1615094868.0,None,neutral
t1_gq1mcep,h1efah5,They're already trained the protesters in Karen army 3 days ago i think,1,1,1623417943.0,ComposerNatural51,neutral
t1_gpzr1k2,gpztl64,What gun can you buy at a store to penetrate a riot control car that most us cities would have in house no need for deployment time.,0,1,1615055928.0,MindNinja757,neutral
t1_gpyccf5,gpycddw,"###[View link](https://redditsave.com/info?url=/r/myanmar/comments/lz10do/myanmar_anticoup_protestors_practising_shield/)


 --- 
 [**Info**](https://np.reddit.com/user/SaveVideo/comments/jv323v/info/)&#32;|&#32; [**Feedback**](https://np.reddit.com/message/compose/?to=Kryptonh&subject=Feedback for savevideo)&#32;|&#32;[**Donate**](https://ko-fi.com/getvideo) &#32;|&#32; [**DMCA**](https://np.reddit.com/message/compose/?to=Kryptonh&subject=Content removal request for savevideo&message=https://np.reddit.com//r/myanmar/comments/lz10do/myanmar_anticoup_protestors_practising_shield/)",1,1,1615040123.0,SaveVideo,neutral
t1_gq0z9yf,gq2c031,Hahaha says the guy under dictatorship,1,1,1615089877.0,Graywhale12,negative
t1_gq4scvg,h2dzb7x,N.O.K short for North Oakkalapa. It's a township in Yangon. each township has it's own protest and the defense shield bears the name of thr township.,1,1,1624156311.0,RyHB24,neutral
t1_gpyxxze,gpyzaok,"I totally get that it’s dangerous and absolutely terrifying to go against a force like that. Yeah, I’m not there in that crowd to fight with them. That’s out of my control. All I can do is give them as much support as I can.",25,2,1615046142.0,Personal-Low4835,negative
t1_gpyxxze,gpzif5o,[deleted],8,2,1615051161.0,None,neutral
t1_gpyxxze,gs0vca0,Don't know why people downvote you. Some people really think thoughts and prayers do something since some guy was born 2000 years ago smh,3,2,1616570313.0,KatilTekir,negative
t1_gpyxxze,gq2a4r1,"I don’t understand how a bunch of neckbeard nerds essentially sending Reddit-version “thoughts and prayers” against civilians going up against armored APC’s and automatic firearms think they’re making a difference. 

“We love you guys keep fighting!” isn’t going to stop a 5.56 round from going through someone’s skull. Send fucking money, supplies, or something tangible.",1,2,1615088712.0,TriggernometryPhD,negative
t1_gpyxxze,gpz9pon,Rohingya.. UN..,0,2,1615048697.0,RandomAsianBloke,neutral
t1_gpyiki7,gq03zh9,"Nah, those sheet metals do nothing against even 9mm rounds.",18,2,1615059301.0,None,negative
t1_gpyiki7,gpzpl3e,Or create deadly shrapnel,7,2,1615054429.0,f33rf1y,negative
t1_gpyiki7,gpzvrnn,Narrator: It didn't do shit against lethal munitions.,6,2,1615056627.0,skepticalbob,negative
t1_gpylhbw,gpz2wni,Thanks man. Cheers. Stay safe.,8,2,1615047069.0,nomoredictator,positive
t1_gpzgeop,gpzhc1e,"[https://en.wikipedia.org/wiki/Testudo\_formation](https://en.wikipedia.org/wiki/Testudo_formation)

[https://en.wikipedia.org/wiki/Roman\_infantry\_tactics](https://en.wikipedia.org/wiki/Roman_infantry_tactics)

Both will give you some good ideas on how to better fine tune what you are doing.",12,2,1615050818.0,None,positive
t1_gq07xru,gq0ofti,"I don't think it's supposed to be used against live rounds. It's supposed to be used against rubber bullets and baton charges, which it looks effective.",8,2,1615065341.0,Magma57,neutral
t1_gq07xru,gq1tpta,We still have shields for close quarters combat. rarely used for clearing buildings but offers more protection then body armor since body armor only protects your chest and back. Flanking isn’t a problem when you’re standing in a hallway or doorway and you don’t need to worry about APCs in a building. Usually it’s police forces vs criminals using small arms which the shields can protect against.,1,2,1615078784.0,-BlueDream-,neutral
t1_gq0rqqf,gq1txk6,You think they give a shit? It’s good propaganda when you can blame fallen soldiers on protestors.,0,2,1615078906.0,-BlueDream-,negative
t1_gpztdnx,gpzuw2r,You’re comparing 1 AR with the army. Now compare the entire population who owns guns with the army.,2,2,1615056356.0,enzo_gm,neutral
t1_gpztdnx,gq0cuw6,"I’d much rather have a firearm than be facing down oppression with a tin shield. Along with the rest of an armed population standing against tyranny.     
Not charging in, but can certainly hold your ground a lot more efficiently.     
Better to be armed than completely defenseless no matter the scenario",1,2,1615062047.0,The_walking_man_,negative
t1_gpztdnx,gq1nxbq,"> The fact you think your ar15 will help against the United States Army shows a big lack of combat experience lol. What's gonna actually get results is smarts in a situation like this. Not America first charging your gun.

Tell me again why is America still fighting the Taliban? Clearly you don’t know what your talking about.",1,2,1615076032.0,Xianb1,negative
t1_gq1u4h0,gq24x7v,"> I saw another video of police just spraying water and tear gas. This will work against that. The shooting has started but it’s not the norm (or there would be hundreds or thousands dead by now). The military can’t be too brutal or it’ll invite a foreign army which they’re not equipped to fight against.

True. But at the same time this ain’t America or China. People are trying to emulate Hong Kong but forget that the World was watching Chinas actions very closely. Myanmar on the other hand has no one watching them. They banned Social Media. I’m amazed to see even any videos surface on the internet.",1,2,1615085488.0,Xianb1,negative
t1_gpztl64,gpztziw,A barrett .50 caliber rifle with black tips,2,2,1615056058.0,mchastain98,neutral
t1_gpyzaok,gq02dpw,"We need more people like you in this world. Solidarity, comrade.",14,3,1615058779.0,None,positive
t1_gpzif5o,gq0s9wi,Chinese people learn about Tiananmen in school tho...,2,3,1615066485.0,PolarBearAppreciator,neutral
t1_gs0vca0,gs2fdy6,I was raised Christian and still believe the Bible is just a good fiction,1,3,1616604483.0,septubyte,positive
t1_gq2a4r1,gq2ctko,"'Fight for your freedom!' Eats a bag of chips. Complains they don't have enough flavour

Its the perspective of privilege. It lacks real consequence but feels like serotonin",1,3,1615090409.0,septubyte,negative
t1_gpzhc1e,gpzis6i,Thank u so much,6,3,1615051270.0,flabbajacks,positive
t1_gq0ofti,gq0sd0q,Also saw some demonstrators using their own shield wall to break police lines and cause chaos amongst their rank. Its obviously not a magic bullet but it works damn well if applied correctly. Noone on the ground is foolish enough to belive a thin metal board will protect them from live fire. Especially considering that most of these folks in the video were probably being shot at not even a day prior to this.,5,3,1615066516.0,bandaidsplus,negative
t1_gq0ofti,gq277h3,"I've seen videos of protestors elsewhere knowing snipers were shooting at them ran out with plywood ""shields"" to know that not everyone gets what is or isn't a ""cover"".

I also see them lying prone on street to make themselves a smaller target I guess but I suppose they also don't quite get that bullets fired and impact hard surfaces like paved road ricochet and skips along the surface. They could still get hit in the face or other vital areas lying down that way.

Once rifles are the riot suppression tool, ok funs and games are over. Time to stop and do something else.",0,3,1615086902.0,None,negative
t1_gq0ofti,gq26vw8,"Yea,but for  every 1000 shots fired, at least 1 is live ammunition",1,3,1615086703.0,None,neutral
t1_gq1tpta,gq1v2tw,"Well, sure, shields have niche use in military/police context, eg, CQB, house clearing; though if collateral damage is less of an issue, frag then clear will be default. Shield allows for some protection and covers in stretches inside a building without covers: hallways, staircase and carries by a pointman.

I was referring to flanking and APC faced by the protestors and shield in general military use. Military probably can use a true bullet resistant shield in niche situations like gunshields on mounted MGs on vehicles or a smaller shield attached to a rifle or MG that allows the user to be more protected when firing aimed shots over covers or from a prone position. Currently, without such protection, troops pinned down by automatic fire can only return aimed fire while exposing their face, throat, and head. Often, they are suppressed if the fire is accurate. With a shield attached to a rifle or MG that exposes only a small slit for sights, sufficiently motived troops can actually fire back somewhat. FOV is bad, but a properly setup defensive position will have narrow fields of fire for each man anyway.",1,3,1615079570.0,None,neutral
t1_gpzuw2r,gq1ujxf,"Even if every single citizen has a gun, that rifle round won’t bring down a F22. Or an M1 tank. And how much ammo do you think civilians have access to? Only a small minority can stockpile enough ammo to last a war and if a war breaks out, the government would have all the means of production. You can’t really fight a war with small arms. Not against an industrialized superpower. 

But this is ignoring the fact that soldiers won’t kill their own people and citizens are very unlikely to get organized enough to actually fight their governments. If anything, it’s going to be small militia factions vs the government and the population in the crossfire like every other attempt to overthrow a government.",3,3,1615079265.0,-BlueDream-,negative
t1_gpzuw2r,gpzvca8,Yeah. It'd take less then 10% of their resources to wipe you and anyone with you away in seconds.,1,3,1615056497.0,MindNinja757,negative
t1_gpzuw2r,gpzvg8e,That's saying if every single citizen had a gun and fought they might need 20% just to save on time.,1,3,1615056529.0,MindNinja757,neutral
t1_gq1nxbq,gq8aig6,"America is at ""war"" with Isis but lets them go free on the populace once they're no longer interested in that specific area. Free and angry mind you as all the citizens supported the Americans until they left them to be butchered over political disinterest.",0,3,1615223571.0,MindNinja757,negative
t1_gq1nxbq,gq89jz8,Because they invade countries constantly without legal justification and are more terrorists there then anything else. Protecting their assets isn't the same as fighting a war..,1,3,1615223162.0,MindNinja757,negative
t1_gq24x7v,gq2669o,"They haven't banned social media...lots of FB, IG, tiktoks, and tweets still coming through on the regular.",3,3,1615086263.0,None,neutral
