Comment Parent ID,Comment ID,Comment Text,Comment Score,Comment Depth,Created Timestamp,Author,sentiment
t1_gq24x7v,gq2szl8,"They actually don’t have the type of control over social media like Mainland China does. They’ve shut off the internet at night but it’s not exclusively social media. We’re watching, it’s just not America’s ally or sphere of influence. If anyone is doing anything it would be China except the protesters are including themselves with Taiwan or Hong Kong which could be a bad thing for them.",2,3,1615102024.0,-BlueDream-,negative
t1_gpztziw,gpzua4u,Jesus you can buy that in America? Lmfao 🤣🤣,1,3,1615056157.0,MindNinja757,negative
t1_gq02dpw,gq2aaie,"People “like him” in this world are fucking useless in a war. Virtual thoughts and prayers do fuck-all when you’re up against machine guns, tanks, and overall annihilation.",-6,4,1615088808.0,TriggernometryPhD,negative
t1_gq0s9wi,gq1py98,Who told you that the ccp? Cause I know borders who went to my high-school that either didn’t know about it or knew little truth and were afraid of discussing or delving farther into the topic. Maybe the Chinese talk about it in school but I doubt it’s an unbiased account.,1,4,1615076690.0,Analbeadsforpa,negative
t1_gq0s9wi,gq3mbgd,"And what do they teach? So they teach that it was a bunch of unarmed students and professors who wanted better treatment and representation? Or do they teach that they were anarchists trying to destroy the Chinese way of life?

Propaganda is subtle and a slight reframing can change the whole meaning.",0,4,1615128183.0,quarkman,negative
t1_gpzis6i,gpzj58g,It's the very least I can do.  I'm thinking about you guys every day and your fight to restore democracy.  Know that the world stands with you.,13,4,1615051374.0,None,positive
t1_gpzis6i,gq4ij6r,Make sure you have the shields afixxed so they can be abandoned fast. Unlike the Romans your enemy has guns that can pierce them. Also have people in your rear who's job it is to tighten the formation. Also have them armed with long polls for pushing between the shields if cracks form so they can push police/mill back out of the gaps. Ide recommend watching police drill videos for inspiration on what to drill for and also ensure your signals can be passed on in any sound environment. Best thing to do is ensure that in the worst case you have everyone passing it on in the ranks.,1,4,1615143844.0,cole3050,neutral
t1_gq1ujxf,gq397fe,Why we still fighting the Taliban then if it’s so impossible to fight the US army with just an AK,1,4,1615118364.0,None,negative
t1_gpzvca8,gpzvkee,Why would america go through the process of wiping out a good amount of its population? You’re not thinking rationally.,2,4,1615056564.0,enzo_gm,negative
t1_gpzvg8e,gq00tgz,Why is your beta ass so scared of guns. 😂 You don't even live in a free country so why do you think your opinion matters at all.,2,4,1615058260.0,mchastain98,negative
t1_gpzua4u,gpzvd88,"Yeah man. If you have the money for it. Also SWAT team armored vehicles are usually rated at a NIJ Type IV armor rating. This means that they can stop a certain amount of most rifle rounds. However, after multiple hits in the same or close to the same spot, the armor will weaken and allow bullets to pass through. So in reality, if 3 dudes mag dumped their ARs into the windshield of one of these trucks, they would probably get through the windshield pretty quick.",1,4,1615056504.0,mchastain98,neutral
t1_gq2aaie,gq3u7mb,"Okay, so what do you expect us to do? Drop everything we have in the States - our families, our college degrees, our whole fucking *lives* - to go put ourselves in the line of fire in a country that we can't even afford a one-way plane ticket to?

Look, I sympathize and empathize with the protestors, but it's because they have ***no other choice but to protest because fascists with machine guns are in their front yard***. But I should go bankrupt flying to Southeast Asia and abandon all my responsibilities and opportunities so I can ""really"" support the cause. Definitely.

You may not like it, but simply signal boosting and showing our support *is the most we can do*, and it's better than nothing.",5,5,1615132663.0,None,negative
t1_gq397fe,gq4b56f,Imagine not remembering that the US has signed a peace treaty with the Taliban just one year ago.,2,5,1615140851.0,akera099,neutral
t1_gq397fe,gq89uzf,"Imagine thinking the USA is actually fighting the Taliban and not just protecting their interests when necessary and ignoring them otherwise.
Remember what country let thousands of Isis prisoners walk out of the jails because they where finished there. Just last year too lmfao",1,5,1615223294.0,MindNinja757,negative
t1_gq397fe,gq8a3bk,I'm waiting for the day I meet an American who actually knows something about their country on a international level. Your America is the greatest attitude is why you're treated like shit in most countries lmfao. America is the greatest at screwing with its own citizens and not getting in trouble,1,5,1615223393.0,MindNinja757,negative
t1_gq397fe,gqekyhd,A small percentage of the us military is actually engaged in the fight against taliban and that’s on foreign territory and they don’t want to kill too many civilians. Quite different from a domestic civil war.,1,5,1615344458.0,-BlueDream-,neutral
t1_gpzvkee,gpzvxc0,Why would this country? Yet we're watching it.,1,5,1615056679.0,MindNinja757,negative
t1_gpzvkee,gpzw4tj,And honestly if we're comparing morals America's known globally for blood not peace. So it lines up way closer then you'd think lol. Heck we saw some potentially close situations just last year no?,1,5,1615056744.0,MindNinja757,negative
t1_gq00tgz,gq8em0b,"Lmfao what's a free country exactly? A ""democracy"" where you have people storming your nations capital to stop a elected president from taking office? Or one where most children have to learn how to hide from a gunman as it's a real and probable threat.  
Or is it about laws the kind that normally get made by one dude signing exec orders? You're the perfect example of an American you know nothing about your country yet think it's better than others.  Y'all can't even do basic measurements at the world stage many would call that undeveloped.

You don't even vote in your own president you just suggest to your electors who they should vote for.",0,5,1615225255.0,MindNinja757,negative
t1_gpzvd88,gpzvshg,That's fuckin nuts. Explains the more mass shootings then days of the year thing you guys got going on. Yes multiple rounds could probably easily do it especially if you got the accuracy time and they just let y'all shoot while they finger their asses.,2,5,1615056634.0,MindNinja757,negative
t1_gq3u7mb,gq3wpwx,"Shut upppp. Literally no one asked for your sob story excuses. 

Either donate supplies/money, travel there to provision on-site aid, or stfu. Posting sympathetic garbage for upvotes on a Reddit board achieves virtually n o t h i n g.

You get your little dose of serotonin and they get turned into Swiss cheese. It’s outright “I feel better about myself” selfish rhetoric.",-6,6,1615133964.0,TriggernometryPhD,negative
t1_gq89uzf,gq8cz3o,Not what my comment was about though??,0,6,1615224607.0,None,neutral
t1_gq8a3bk,gq8d2dt,"Thats not even what my comment was about bro? Get off the shrooms, they are messing with your head",0,6,1615224643.0,None,negative
t1_gpzw4tj,gpzwkge,"No lol, I need a reminder. I don’t recall any time when the military killed a large percent of the population. Except for wounded knee, which was what happened when the military tried to disarm the population. Now imagine that but 50x as large. Not gonna happen.",3,6,1615056878.0,enzo_gm,negative
t1_gpzvshg,gpzx5q1,"You're clearly a pretty uneducated dude when it comes to firearms knowledge, combat tactics, and gun violence statistics. I'll leave this resource here so you can learn a little more. https://americangunfacts.com/",0,6,1615057061.0,mchastain98,negative
t1_gpzvshg,gpzxhx3,"Mass shootings account for far less than 1 percent of homicides in America. They are also almost exclusive in zones deemed ""gun free."" So no one is able to defend themselves.",-1,6,1615057166.0,mchastain98,negative
t1_gq3wpwx,gq4lrat,"Tries to be kind and supportive on Reddit and gets this bullshit as a response... it isn’t about the upvotes at all either. But whatever, be a toxic asshole if that’s what you want.",8,7,1615145175.0,Personal-Low4835,negative
t1_gq3wpwx,gq4mb8g,"Also, to make everything crystal clear for you: I have no money. No transport. So you telling me to shut the fuck up when this is all I can do at the moment is actually kind of messed up. Whatever. Say and do what you want, I get it’s hard over there and you are angry.",7,7,1615145403.0,Personal-Low4835,negative
t1_gq8cz3o,gq8d9k8,The us isn't fighting the Taliban they're protecting interests not acting in the interests of war. So yeah of course the Taliban still exist your initial comment was based off incorrect information,1,7,1615224724.0,MindNinja757,negative
t1_gq8cz3o,gq8di19,"They're using small amounts of resources to do small jobs relating to Taliban activities that's about it.
Not at all like a military using reserve Forces and all its weapons and tech that are already in the country they'd be fighting in. The comparison makes 0 real points",1,7,1615224819.0,MindNinja757,negative
t1_gq8d2dt,gq8flci,Jesus you know it's a weak argument when you gotta stalk the guys page and use the only Reddit post he made to try and discredit him.,1,7,1615225640.0,MindNinja757,negative
t1_gpzwkge,gpzx0po,They've killed a large precent of many countries populations? Take your pick. Just because you have had it happen internally doesn't mean you won't. Unless you're seriously going to say America's stable and non violent these days.,1,7,1615057019.0,MindNinja757,negative
t1_gpzwkge,gpzx9dj,Y'all commited some of the worst recorded war crimes especially since WW2 with little to no justification and still let those soliders go free with immunity. So like again not the moral high ground,1,7,1615057092.0,MindNinja757,negative
t1_gpzx5q1,gpzxv2a,You're pretty uneducated in human behaviour if you seriously think your neighbors are as capable as you claim. I'm sure you spend lots of time in the range and think you're combat ready yet never fired a shot under duress playing games at home isn't war it's not even close.,1,7,1615057283.0,MindNinja757,negative
t1_gpzxhx3,gpzyili,"""Do 98 percent of mass public shootings happen in gun-free zones? - The Washington Post"" https://www.washingtonpost.com/news/fact-checker/wp/2018/05/10/do-98-percent-of-mass-public-shootings-happen-in-gun-free-zones/?outputType=amp

I mean if you only interpret stats when they fit your narritive sure anything is true.",3,7,1615057486.0,MindNinja757,neutral
t1_gq4mb8g,gq51ru6,"Woe is you. 🎻 

No one gives a shit about what you don’t have. It ain’t about you; hop off your soapbox. Someone struggling in a western first world country is still eons ahead of someone in the 3rd world. Perspective. 

I *am* angry. What’s happening over there is utterly atrocious.",-2,8,1615151845.0,TriggernometryPhD,negative
t1_gq8d9k8,gq8dj4m,Dude. Thats still not what my comment was about you are wasting your time bruh,0,8,1615224831.0,None,negative
t1_gq8di19,gq8dplv,Are you a fucking retard? Who tf asked you to talk about this?,0,8,1615224901.0,None,negative
t1_gq8flci,gq8fv9c,"Just stop dude, you are making yourself look really retarded",0,8,1615225748.0,None,negative
t1_gpzx0po,gq0x2hp,"IDK, but they might be a little hesitant to kill masses of their own citizens. Agree that America is disgusting and genocidal though.",1,8,1615067990.0,None,negative
t1_gpzxv2a,gq004cp,🏴 ok bro,0,8,1615058033.0,mchastain98,neutral
t1_gq51ru6,gq5fd2z,"I was only telling you that because you expect me to stop everything I’m doing to go to a whole other country and give people money that I don’t have. What’s happening is fucking awful, but that don’t mean you have an excuse to be a piece of shit to me simply for saying kind words on the internet.",3,9,1615157784.0,Personal-Low4835,negative
t1_gq8dplv,gq8fdv7,You dumbass. You literally used the USA is still fighting the Taliban as a argument and that statement has no basis in reality.,1,9,1615225558.0,MindNinja757,negative
t1_gq8fv9c,gq8gab7,I mean maybe. But I'm still doing better then the average American. Look I'm even winning more internet points 🤣,1,9,1615225914.0,MindNinja757,positive
t1_gq5fd2z,gq5vbha,"Saying kind words for the sake of feeling involved is selfish. They’re not looking for kindness, they’re looking for resources, strength, justice, etc. 

I’m not being a piece of shit towards you, I’m giving you truth that contradicts your perception. You’re probably a standup person, just out of touch.",-1,1,1615166513.0,TriggernometryPhD,negative
t1_gq8fdv7,gq8foqa,"I was comparing the US long involvement in the middle east to how *not* easy it is to best an armed insurgent force. It doesn't matter if the taliban are beat now or even a year ago, it took 20 years. Please stop using the drugs if you wanna talk bro",1,1,1615225678.0,None,negative
t1_gq8gab7,gq8go7k,":/ I don't think so, bucko. I wouldn't have brought this up but okay, you mentioned it. I have more internet points than you\_*-*_/",0,1,1615226070.0,None,negative
t1_gq5vbha,gq5vk7b,It’s not about being involved in anything. It’s simply about encouraging people to defend their freedoms. Sorry that I can’t give you exactly what you want 🤷‍♀️,4,2,1615166644.0,Personal-Low4835,neutral
t1_gq8foqa,gq8fytv,"They aren't actively trying to beat them. They're defending the areas the us occupies and respond to possible attacks against the USA only. They'd watch a school get shotup and let the shooters walk if it was outside of their active zone.
They're also expending pretty small amounts of resources especially compared to if there was a homeland issue.",1,2,1615225788.0,MindNinja757,negative
t1_gq8go7k,gq8gvtl,"I meant for the thread I don't use Reddit that often. Mr active in conspiracy groups lmfao. 
Qanon follower?",1,2,1615226160.0,MindNinja757,neutral
t1_gq8go7k,gq8h1we,"Bro this is a little embarassing
https://www.reddit.com/r/karmawhore/comments/lbtnt2/hi_can_i_please_get_25_upvotes_so_i_can_tell/?utm_medium=android_app&utm_source=share",1,2,1615226232.0,MindNinja757,negative
t1_gq5vk7b,gq5xu2t,The fact you fail to grasp the bigger picture and still think this is about you or I says everything. Get your little cheerleader fix and move onto the next feel-good thread.,0,3,1615167880.0,TriggernometryPhD,negative
t1_gq8gvtl,gq8h0n1,Gotta keep up with the crazy people dude,1,3,1615226217.0,None,neutral
t1_gq8h1we,gq8h4f9,"Hey man, sometimes you gotta do what you gotta do",1,3,1615226263.0,None,neutral
t1_gq5xu2t,gq5yop8,Lmao bruh I never said it was about me. It’s really bout you expecting us to be able send money and that being supportive don’t mean shit when actually kind words and motivation can be exactly what someone needs.,3,4,1615168355.0,Personal-Low4835,negative
